{
  "id": "550e8400-e29b-41d4-a716-446655440000",
  "timestamp": "2026-06-24T08:00:00.000Z",
  "actor_user_id": "550e8400-e29b-41d4-a716-446655440001",
  "actor_username": "zhangsan",
  "actor_role": "branch_admin",
  "branch_org_id": "550e8400-e29b-41d4-a716-446655440002",
  "action": "archive_filing",
  "resource_type": "archive_volume",
  "resource_id": "550e8400-e29b-41d4-a716-446655440003",
  "resource_label": "某某工程竣工档案卷",
  "result": "success",
  "client_ip": "10.0.1.100",
  "request_id": "req-20260624-001"
}
